{
  "site": "books.toscrape.com",
  "audited_at": "2026-10-08T08:51:42Z",
  "summary": {
    "total_findings": 10,
    "critical": 0,
    "high": 2,
    "medium": 6,
    "low": 2,
    "info": 0
  },
  "audit": {
    "marketplace_version": "1.0.0",
    "entrypoint": "brand-ai-readiness-audit",
    "duration_seconds": 69.9,
    "phase_timings": {
      "robots": 1.357,
      "discovery": 34.602,
      "sampling": 0.039,
      "fetch": 6.765,
      "control_fetch": 22.675,
      "query_preservation": 0.0,
      "classify": 0.004,
      "render": 0.927
    },
    "no_changes_made": true,
    "duplicate_findings_merged": 0
  },
  "coverage": {
    "pages_discovered": 412,
    "pages_sampled": 25,
    "pages_fetched": 25,
    "pages_rendered": 0,
    "blocked_by_robots": 0,
    "fetch_failures": 0,
    "requests_made": 69,
    "request_cap": 120,
    "template_clusters": [
      "/",
      "/catalogue/arena_587/index.html",
      "/catalogue/beowulf_126/index.html",
      "/catalogue/bossypants_883/index.html",
      "/catalogue/burning_884/index.html",
      "/catalogue/candide_316/index.html",
      "/catalogue/category/books/academic_40/index.html",
      "/catalogue/category/books/art_25/index.html",
      "/catalogue/category/books/autobiography_27/index.html",
      "/catalogue/category/books/biography_36/index.html",
      "/catalogue/category/books/business_35/index.html",
      "/catalogue/category/books/childrens_11/index.html",
      "/catalogue/category/books/childrens_11/page-2.html",
      "/catalogue/category/books/christian_43/index.html",
      "/catalogue/category/books/classics_6/index.html",
      "/catalogue/category/books/contemporary_38/index.html",
      "/catalogue/category/books/crime_51/index.html",
      "/catalogue/category/books/cultural_49/index.html",
      "/catalogue/category/books/default_15/index.html",
      "/catalogue/category/books/default_15/page-2.html",
      "/catalogue/category/books/erotica_50/index.html",
      "/catalogue/category/books/fantasy_19/index.html",
      "/catalogue/category/books/fantasy_19/page-2.html",
      "/catalogue/category/books/fiction_10/index.html",
      "/catalogue/category/books/fiction_10/page-2.html",
      "/catalogue/category/books/health_47/index.html",
      "/catalogue/category/books/historical_42/index.html",
      "/catalogue/category/books/history_32/index.html",
      "/catalogue/category/books/horror_31/index.html",
      "/catalogue/category/books/humor_30/index.html",
      "/catalogue/category/books/music_14/index.html",
      "/catalogue/category/books/mystery_3/index.html",
      "/catalogue/category/books/mystery_3/page-2.html",
      "/catalogue/category/books/nonfiction_13/index.html",
      "/catalogue/category/books/nonfiction_13/page-2.html",
      "/catalogue/category/books/novels_46/index.html",
      "/catalogue/category/books/paranormal_24/index.html",
      "/catalogue/category/books/parenting_28/index.html",
      "/catalogue/category/books/philosophy_7/index.html",
      "/catalogue/category/books/poetry_23/index.html",
      "/catalogue/category/books/politics_48/index.html",
      "/catalogue/category/books/psychology_26/index.html",
      "/catalogue/category/books/religion_12/index.html",
      "/catalogue/category/books/romance_8/index.html",
      "/catalogue/category/books/romance_8/page-2.html",
      "/catalogue/category/books/science_22/index.html",
      "/catalogue/category/books/spirituality_39/index.html",
      "/catalogue/category/books/suspense_44/index.html",
      "/catalogue/category/books/thriller_37/index.html",
      "/catalogue/category/books/travel_2/index.html",
      "/catalogue/category/books/{slug}/index.html",
      "/catalogue/category/books/{slug}/page-2.html",
      "/catalogue/category/books_1/index.html",
      "/catalogue/category/books_1/page-2.html",
      "/catalogue/cell_674/index.html",
      "/catalogue/emma_17/index.html",
      "/catalogue/join_902/index.html",
      "/catalogue/life_104/index.html",
      "/catalogue/meditations_33/index.html",
      "/catalogue/meternity_478/index.html",
      "/catalogue/olio_984/index.html",
      "/catalogue/page-2.html",
      "/catalogue/patience_916/index.html",
      "/catalogue/rook_647/index.html",
      "/catalogue/shameless_52/index.html",
      "/catalogue/shtum_733/index.html",
      "/catalogue/soumission_998/index.html",
      "/catalogue/thirst_946/index.html",
      "/catalogue/{slug}/index.html",
      "/index.html"
    ],
    "site_archetype": "mixed",
    "page_type_counts": {
      "homepage": 1,
      "unknown": 6,
      "contact": 8,
      "category": 10
    },
    "capabilities": {
      "headless_render": false,
      "external_search": false
    },
    "not_assessed": [
      {
        "dimension": "inbound parameter preservation",
        "reason": "no sampled URL redirected, so there was nothing to probe"
      },
      {
        "dimension": "browser render comparison",
        "reason": "a headless browser is installed but would not start: BrowserType.launch: Executable doesn't exist at C:\\Users\\patha\\AppData\\Local\\ms-playwright\\chromium_headless_shell-1234\\chrome-headless-shell-win64\\chrome-headless-shell.exe\n\u2554\u2550\u2550\u2550\u2550\u2550\u2550\u2550\u2550\u2550\u2550\u2550\u2550\u2550\u2550\u2550\u2550\u2550\u2550\u2550\u2550\u2550\u2550\u2550\u2550\u2550"
      },
      {
        "dimension": "off-site corroboration",
        "reason": "no external search capability was made available to this run"
      },
      {
        "dimension": "content behind interaction",
        "reason": "this marketplace's collector never clicks, submits or interacts with a page by design, so content that only appears after a tab, accordion or similar interaction cannot be distinguished from content that was never going to appear at all. This is a permanent architectural limit, not a capability that a browser being available would remove.",
        "detector": "render-readability-audit"
      }
    ],
    "degradations": [],
    "blocked_urls": [],
    "failures": []
  },
  "findings": [
    {
      "check_id": "SDE.NO_ORGANIZATION_NODE",
      "title": "The homepage declares no organization or local-business entity",
      "reach": "sitewide",
      "funnel_stage": "understood",
      "detector": "structured-data-entity-audit",
      "evidence": "The homepage (https://books.toscrape.com/) has no Organization, LocalBusiness or equivalent entity in its JSON-LD, Microdata or RDFa, after traversing any @graph fully. There is no explicit machine-readable statement of which brand this site belongs to.",
      "affected_urls": [
        "https://books.toscrape.com/"
      ],
      "evidence_detail": {
        "method": "JSON-LD @graph traversal, Microdata itemtype and RDFa typeof checked for an Organization, LocalBusiness or Corporation node on the homepage",
        "observed": {
          "jsonld_types_found": [],
          "microdata_types_found": [],
          "rdfa_types_found": []
        },
        "expected": "an Organization or LocalBusiness node on the homepage",
        "sample": {
          "checked": 1,
          "failing": 1
        },
        "confidence": "high",
        "nondeterministic": false,
        "check_id": "SDE.NO_ORGANIZATION_NODE",
        "detector": "structured-data-entity-audit"
      },
      "suggested_action": {
        "summary": "Add one Organization (or LocalBusiness, if there is a physical location) node to the homepage, in JSON-LD, with a stable identifier.",
        "how": [
          "Include at minimum name, url, and logo.",
          "Give it an @id so other structured data on the site can reference it rather than duplicating it.",
          "Add sameAs links to profiles the brand actually controls."
        ],
        "mechanism": "This is the single node a system uses to resolve 'this site' into 'this real-world brand'. Without it, every other page's content is attributed to an inferred entity rather than a declared one.",
        "effort": "template-change",
        "owner": "engineering",
        "verification": "Fetch the homepage and confirm an Organization node with a name and url parses successfully.",
        "priority": "high"
      },
      "severity": "high",
      "id": "F-001"
    },
    {
      "check_id": "SDE.NO_STRUCTURED_DATA",
      "title": "No structured data of any kind was found on the sampled pages",
      "reach": "sitewide",
      "funnel_stage": "understood",
      "detector": "structured-data-entity-audit",
      "evidence": "None of the 21 sampled content pages carry JSON-LD, Microdata or RDFa. A machine can read the text but has no explicit signal for what kind of thing each page describes or which entity it belongs to.",
      "affected_urls": [
        "https://books.toscrape.com/",
        "https://books.toscrape.com/catalogue/1000-places-to-see-before-you-die_1/index.html",
        "https://books.toscrape.com/catalogue/category/books/add-a-comment_18/index.html",
        "https://books.toscrape.com/catalogue/category/books/art_25/index.html",
        "https://books.toscrape.com/catalogue/category/books/autobiography_27/index.html",
        "https://books.toscrape.com/catalogue/category/books/biography_36/index.html",
        "https://books.toscrape.com/catalogue/category/books/business_35/index.html",
        "https://books.toscrape.com/catalogue/category/books/childrens_11/index.html",
        "https://books.toscrape.com/catalogue/category/books/christian_43/index.html",
        "https://books.toscrape.com/catalogue/category/books/classics_6/index.html",
        "https://books.toscrape.com/catalogue/category/books/contemporary_38/index.html",
        "https://books.toscrape.com/catalogue/category/books/default_15/index.html",
        "https://books.toscrape.com/catalogue/category/books/fantasy_19/index.html",
        "https://books.toscrape.com/catalogue/category/books/fiction_10/index.html",